{
  "document_id": "PS_013",
  "source_files": [
    "data/raw_images/DataSet/printed_docuemnts/PS_013.jpeg"
  ],
  "page_count": 1,
  "document_header": {
    "document_type": "payroll_slip",
    "document_title_ar": "بيانات الصرف الدوري للقائم بالصرف",
    "issuing_authority_ar": "الهيئة القومية للتأمين الاجتماعي / صندوق العاملين بقطاعي الأعمال العام والخاص",
    "template_code": "BENINPBO/BEINSBO",
    "print_datetime": "2022/04/18",
    "region_code": "07",
    "region_name": "المنوفية",
    "office_code": "13",
    "office_name": "شبين الكوم ثان",
    "unit": null,
    "reference_number": null
  },
  "ids": {
    "national_id": "3470601710190",
    "insurance_number": "49734230",
    "paying_agent_insurance_number": "31261345",
    "paying_agent_national_id": "23508121700142"
  },
  "personal": {
    "full_name_triple": "علي البسيوني علي اسماعيل",
    "family_name": null,
    "mother_name": null,
    "gender": "ذكر",
    "date_of_birth": null,
    "governorate_code": null,
    "governorate_name": null,
    "district_code": null,
    "district_name": null,
    "sector_law": null
  },
  "social_insurance": null,
  "payroll": {
    "pension_sector": "قانون 75/79 للعاملين بقطاع الأعمال العام",
    "follow_up_office": "المنوفية - مكتب شبين الكوم ثان",
    "payment_start_date": "1-2003",
    "disbursement_bank": "بنك ناصر الاجتماعي",
    "payment_type": null,
    "current_account_number": null,
    "total_entitlement": "1958 جنيه",
    "total_deductions": "39 جنيه",
    "net_pension": "1919 جنيه",
    "paying_agent": {
      "name": "سلطان اوبة سليمان يوسف"
    },
    "form_codes": [
      "ENTER",
      "PF06",
      "PF10",
      "PF03"
    ]
  },
  "uncertain_fields": [
    "ids.national_id",
    "ids.insurance_number",
    "ids.paying_agent_insurance_number",
    "ids.paying_agent_national_id",
    "personal.full_name_triple",
    "payroll.paying_agent.name",
    "payroll.total_entitlement",
    "payroll.total_deductions",
    "payroll.net_pension"
  ],
  "review_required": true,
  "review_notes": [
    "payroll slip is faint; several identity and amount fields need human review"
  ]
}