{
  "document_id": "PS_004",
  "source_files": [
    "data/raw_images/DataSet/printed_docuemnts/PS_004.jpeg"
  ],
  "page_count": 1,
  "document_header": {
    "document_type": "social_insurance_inquiry",
    "document_title_ar": "استعلام بيانات مؤمن عليه بالملف التأميني",
    "issuing_authority_ar": "الهيئة القومية للتأمين الاجتماعي / صندوق العاملين بقطاعي الأعمال العام والخاص",
    "template_code": "INDNO050/INDNS08",
    "print_datetime": "2023/12/04",
    "region_code": "07",
    "region_name": "المنوفية",
    "office_code": "01",
    "office_name": "شبين الكوم أول",
    "unit": null,
    "reference_number": "48326205/1890"
  },
  "ids": {
    "national_id": "26808221700375",
    "insurance_number": "19641519",
    "paying_agent_insurance_number": null,
    "paying_agent_national_id": null
  },
  "personal": {
    "full_name_triple": "عادل حلمي اسد احمد",
    "family_name": "فسطه",
    "mother_name": "امينة حسن",
    "gender": "ذكر",
    "date_of_birth": "1968/08/22",
    "governorate_code": "17",
    "governorate_name": "المنوفية",
    "district_code": "02",
    "district_name": "مركز شبين الكوم",
    "sector_law": null
  },
  "social_insurance": {
    "insurance_status": "لا توجد بيانات تأمينية",
    "insurance_status_note": "لا توجد بيانات تأمينية لهذا الشخص",
    "main_center_address": "٣ ش الألفي - القاهرة",
    "website": "WWW.NOSI.GOV.EG",
    "customer_service_number": "16217",
    "fax_number": "25912453"
  },
  "payroll": null,
  "uncertain_fields": [
    "ids.national_id",
    "personal.full_name_triple",
    "personal.family_name"
  ],
  "review_required": false,
  "review_notes": []
}